{
  "$schema": "https://json-schema.org/draft/2020-12/schema",
  "$id": "https://local.codex/evals/result-record.schema.json",
  "title": "Codex Eval Result Record",
  "type": "object",
  "required": [
    "schema_version",
    "case_id",
    "workflow",
    "run_timestamp",
    "outcome",
    "observed_subagents",
    "observed_validation",
    "observed_fail_signals",
    "notes"
  ],
  "properties": {
    "schema_version": {
      "type": "string"
    },
    "case_id": {
      "type": "string"
    },
    "workflow": {
      "type": "string"
    },
    "fixture_ref": {
      "type": "string"
    },
    "run_timestamp": {
      "type": "string",
      "format": "date-time"
    },
    "outcome": {
      "type": "string",
      "enum": [
        "pass",
        "partial",
        "fail"
      ]
    },
    "observed_subagents": {
      "type": "array",
      "items": {
        "type": "string"
      }
    },
    "observed_validation": {
      "type": "array",
      "items": {
        "type": "string"
      }
    },
    "observed_fail_signals": {
      "type": "array",
      "items": {
        "type": "string"
      }
    },
    "notes": {
      "type": "string"
    },
    "rubric": {
      "type": "object",
      "properties": {
        "trigger_match": {
          "type": [
            "boolean",
            "null"
          ]
        },
        "output_shape_ok": {
          "type": [
            "boolean",
            "null"
          ]
        },
        "safety_ok": {
          "type": [
            "boolean",
            "null"
          ]
        },
        "validation_ok": {
          "type": [
            "boolean",
            "null"
          ]
        }
      },
      "additionalProperties": false
    }
  },
  "additionalProperties": false
}
