{
  "schema_version": "2",
  "case_id": "oi-bugfix-validate-positive",
  "workflow": "orchestrated-implementation",
  "fixture_ref": "tiny-python-service",
  "run_timestamp": "2026-03-31T00:00:00Z",
  "outcome": "pass",
  "observed_subagents": [
    "pr-explorer"
  ],
  "observed_validation": [
    "context:repo-inspected",
    "implementation:main-agent",
    "validation-skill:build-validate",
    "command:pytest"
  ],
  "observed_fail_signals": [],
  "notes": "Baseline expects staged context gathering, main-agent implementation, and post-change validation.",
  "rubric": {
    "trigger_match": true,
    "output_shape_ok": true,
    "safety_ok": true,
    "validation_ok": true
  }
}
