{
  "schema_version": "2",
  "case_id": "bv-api-boundary-positive",
  "workflow": "build-validate",
  "fixture_ref": "tiny-python-service",
  "outcome": "pass",
  "observed_subagents": [],
  "observed_validation": [
    "scope:escalated",
    "reason:api-contract",
    "command:pytest",
    "repo:inspected",
    "status:blocked",
    "risk:caller-compat"
  ],
  "observed_fail_signals": [],
  "notes": "Validation scope: escalated, because the frozen diff changes the public return contract of `lookup_user()` from `str` to `dict[str, str]`, which is compatibility-sensitive. Commands run: `pytest`. Passed: repo/task inspection of `TASK.md`, `api_breaking_change.patch`, `pyproject.toml`, and current source/tests confirmed `pytest` is the canonical repo-native validation command and that the change is an API-boundary change. Failed: none. Not run: `pytest` could not execute because the command was unavailable in the environment (`pytest: command not found`). Remaining unverified: behavior of the patched tree, downstream caller compatibility with the new return type, and any regression coverage beyond the single updated API test.",
  "rubric": {
    "trigger_match": true,
    "output_shape_ok": true,
    "safety_ok": true,
    "validation_ok": true
  },
  "run_timestamp": "2026-03-31T08:20:22Z"
}
