{
  "schema_version": "2",
  "case_id": "or-current-diff-multi-angle-positive",
  "workflow": "orchestrated-review",
  "fixture_ref": "tiny-review-surface",
  "run_timestamp": "2026-03-31T00:00:00Z",
  "outcome": "pass",
  "observed_subagents": [
    "pr-explorer",
    "reviewer",
    "security-auditor"
  ],
  "observed_validation": [
    "findings:first",
    "findings:deduplicated",
    "uncertainty:carried-forward"
  ],
  "observed_fail_signals": [],
  "notes": "Baseline expects selective specialist use because the frozen diff mixes review and security surfaces.",
  "rubric": {
    "trigger_match": true,
    "output_shape_ok": true,
    "safety_ok": true,
    "validation_ok": true
  }
}
