{
  "schema_version": "2",
  "case_id": "bv-api-boundary-positive",
  "workflow": "build-validate",
  "fixture_ref": "tiny-python-service",
  "run_timestamp": "2026-03-31T00:00:00Z",
  "outcome": "pass",
  "observed_subagents": [],
  "observed_validation": [
    "scope:escalated",
    "command:pytest",
    "compatibility:called-out",
    "reporting:explicit-buckets"
  ],
  "observed_fail_signals": [],
  "notes": "Baseline expects repo-native validation planning against the frozen API-breaking patch.",
  "rubric": {
    "trigger_match": true,
    "output_shape_ok": true,
    "safety_ok": true,
    "validation_ok": true
  }
}
